,tweet_id,timestamp,text,expanded_urls,rating_numerator,rating_denominator,name,good_dog_stage,p1,p1_conf,p1_dog,p2,p2_conf,p2_dog,p3,p3_conf,p3_dog,retweet_count,favorite_count
996,718454725339934721,2016-04-08 15:05:29,"This pic is old but I hadn't seen it until today and had to share. Creative af. 13/10 very good boy, would pet well https://t.co/4kD16wMA1Z",https://twitter.com/dog_rates/status/718454725339934721/photo/1,13,10,None,unavailable,Hammer,16.986500000000003,False,Hatchet,11.5744,False,Chime,6.80916,False,1685,5320
997,718246886998687744,2016-04-08 01:19:36,This is Alexanderson. He's got a weird ass birth mark. Dreadful at fetch. Won't eat kibble. 3/10 wtf @Target https://t.co/FmxOpf2Sgl,https://twitter.com/dog_rates/status/718246886998687744/photo/1,3,10,Alexanderson,unavailable,Chihuahua,35.448800000000006,True,Carton,15.9672,False,Siberian_Husky,5.749830000000001,True,565,2115
998,718234618122661888,2016-04-08 00:30:51,This is Suki. She was born with a blurry tail (unfortunate). Next level tongue tho. 11/10 nifty hardwood https://t.co/05S8oYztgb,https://twitter.com/dog_rates/status/718234618122661888/photo/1,11,10,Suki,unavailable,Malamute,37.0152,True,Siberian_Husky,35.6398,True,Eskimo_Dog,27.1042,True,1127,4217
999,717841801130979328,2016-04-06 22:29:56,This is Barclay. His father was a banana. 11/10 appeeling af https://t.co/ucOEfr2rjV,https://twitter.com/dog_rates/status/717841801130979328/photo/1,11,10,Barclay,unavailable,Brittany_Spaniel,92.2876,True,English_Springer,7.011349999999999,True,Bath_Towel,0.256079,False,670,2660
1000,717790033953034240,2016-04-06 19:04:14,"Here's a badass mystery pupper. You weren't aware that you owe him money, but you do. 10/10 shades sick af https://t.co/fv9e9AtzSG",https://twitter.com/dog_rates/status/717790033953034240/photo/1,10,10,None,pupper,Car_Mirror,81.9106,False,Minibus,10.7383,False,Cab,3.4846399999999997,False,1272,3170
1001,717537687239008257,2016-04-06 02:21:30,People please. This is a Deadly Mediterranean Plop T-Rex. We only rate dogs. Only send in dogs. Thanks you... 11/10 https://t.co/2ATDsgHD4n,https://twitter.com/dog_rates/status/717537687239008257/photo/1,11,10,a,unavailable,Golden_Retriever,77.93560000000001,True,Labrador_Retriever,5.251140000000001,True,Kuvasz,4.98105,True,2069,6281
1002,717428917016076293,2016-04-05 19:09:17,This is Skittle. He's trying to communicate. 11/10 solid effort https://t.co/6WTfJvtKx6,https://vine.co/v/iIhEU2lVqxz,11,10,Skittle,unavailable,,,,,,,,,,510,1748
1003,717421804990701568,2016-04-05 18:41:02,This is Ebby. She's a Zimbabwean Feta. Embarrassed by ridiculously squishy face. 9/10 would squeeze softly https://t.co/LBJqxMGaHi,"https://twitter.com/dog_rates/status/717421804990701568/photo/1,https://twitter.com/dog_rates/status/717421804990701568/photo/1",9,10,Ebby,unavailable,Miniature_Pinscher,28.6479,True,Italian_Greyhound,8.41339,True,Beagle,6.4697000000000005,True,945,3446
1004,717047459982213120,2016-04-04 17:53:31,This is FlÃ¡vio (pronounced Baxter). He's a Benesnoop Cumberdog. Super rare. Symmetrical. 12/10 would pet so well https://t.co/fGgleFiBPq,https://twitter.com/dog_rates/status/717047459982213120/photo/1,12,10,FlÃ¡vio,unavailable,Golden_Retriever,98.3548,True,Labrador_Retriever,1.2185400000000002,True,Cocker_Spaniel,0.241203,True,2135,6826
1005,717009362452090881,2016-04-04 15:22:08,This is Smokey. He's having some sort of existential crisis. 10/10 hang in there pupper https://t.co/JmgF4dMpw0,https://twitter.com/dog_rates/status/717009362452090881/photo/1,10,10,Smokey,pupper,Siberian_Husky,50.6154,True,Eskimo_Dog,26.965600000000002,True,Malamute,6.065849999999999,True,1102,3583
1006,716802964044845056,2016-04-04 01:41:58,This is Link. He struggles with couches. 10/10 would assist https://t.co/SbX4e6Yg3o,"https://twitter.com/dog_rates/status/716802964044845056/photo/1,https://twitter.com/dog_rates/status/716802964044845056/photo/1",10,10,Link,unavailable,Malinois,61.9577,True,Leonberg,11.8089,True,Bull_Mastiff,6.650779999999999,True,1317,4627
1007,716791146589110272,2016-04-04 00:55:01,Meet Jennifur. She's supposed to be navigating. Not even buckled up. Insubordinate &amp; churlish. 11/10 would still pet https://t.co/h0trcJohYO,https://twitter.com/dog_rates/status/716791146589110272/photo/1,11,10,Jennifur,unavailable,Pomeranian,46.875099999999996,True,Seat_Belt,15.465200000000001,False,Golden_Retriever,12.501700000000001,True,1474,5204
1008,716730379797970944,2016-04-03 20:53:33,"There has clearly been a mistake. Pup did nothing wrong. 12/10 would help escape
https://t.co/Juid3nnLbC",https://twitter.com/chpsanfrancisco/status/716637124322177024,12,10,None,unavailable,,,,,,,,,,475,1339
1009,716447146686459905,2016-04-03 02:08:05,This is Ozzy. He's acrobatic af. Legendary pupper status achieved. 13/10 https://t.co/gHWsCTu90E,https://vine.co/v/eMmXVPn5eQK,13,10,Ozzy,pupper,,,,,,,,,,6643,14327
1010,716285507865542656,2016-04-02 15:25:47,This is Stephanus. She stays woke. 12/10 https://t.co/WIWabMngQZ,"https://twitter.com/dog_rates/status/716285507865542656/photo/1,https://twitter.com/dog_rates/status/716285507865542656/photo/1",12,10,Stephanus,unavailable,Yorkshire_Terrier,43.042,True,Silky_Terrier,19.6769,True,Cairn,7.26761,True,1225,3041
1011,716080869887381504,2016-04-02 01:52:38,Here's a super majestic doggo and a sunset 11/10 https://t.co/UACnoyi8zu,"https://twitter.com/dog_rates/status/716080869887381504/photo/1,https://twitter.com/dog_rates/status/716080869887381504/photo/1",11,10,None,doggo,Golden_Retriever,63.8625,True,Chow,25.471700000000002,True,Tibetan_Mastiff,7.17317,True,1935,5272
1012,715928423106027520,2016-04-01 15:46:52,This is Bubbles. He's a Yorkshire Piccolope. 11/10 would snug aggressively https://t.co/3BhMojONxq,https://twitter.com/dog_rates/status/715928423106027520/photo/1,11,10,Bubbles,unavailable,Pug,97.66850000000001,True,French_Bulldog,1.96626,True,Bull_Mastiff,0.227819,True,987,3485
1013,715758151270801409,2016-04-01 04:30:16,This is old now but it's absolutely heckin fantastic and I can't not share it with you all. 13/10  https://t.co/wJX74TSgzP,https://vine.co/v/hYdLVKDpAFu,13,10,old,unavailable,,,,,,,,,,1596,4085
1014,715733265223708672,2016-04-01 02:51:22,This is a taco. We only rate dogs. Please only send in dogs. Dogs are what we rate. Not tacos. Thank you... 10/10 https://t.co/cxl6xGY8B9,https://twitter.com/dog_rates/status/715733265223708672/photo/1,10,10,a,unavailable,Dandie_Dinmont,74.0229,True,Miniature_Poodle,8.191510000000001,True,Toy_Poodle,6.37485,True,1920,5093
1015,715704790270025728,2016-04-01 00:58:13,This is Bentley. He gives kisses back. 11/10 precious af (vid by @emmaallen25) https://t.co/9PnKkKzoUp,https://vine.co/v/ijAlDnuOD0l,11,10,Bentley,unavailable,,,,,,,,,,634,3055
1016,715696743237730304,2016-04-01 00:26:15,Meet Toby. He's a Lithuanian High-Steppin Stickeroo. One of the more accomplished Stickeroos around. 10/10 so nifty https://t.co/cYPHuJYTjC,https://twitter.com/dog_rates/status/715696743237730304/photo/1,10,10,Toby,unavailable,Staffordshire_Bullterrier,42.7836,True,Pug,22.1409,True,French_Bulldog,13.2135,True,1454,4257
1017,715680795826982913,2016-03-31 23:22:53,This is Zeus. He's downright fabulous. 12/10 https://t.co/sSugyyRuTp,"https://twitter.com/dog_rates/status/715680795826982913/photo/1,https://twitter.com/dog_rates/status/715680795826982913/photo/1,https://twitter.com/dog_rates/status/715680795826982913/photo/1",12,10,Zeus,unavailable,Golden_Retriever,99.0715,True,Labrador_Retriever,0.222834,True,Chow,0.11971499999999999,True,1813,4719
1018,715360349751484417,2016-03-31 02:09:32,This is Bertson. He just wants to say hi. 11/10 would boop nose https://t.co/hwv7Wq6gDA,https://twitter.com/dog_rates/status/715360349751484417/photo/1,11,10,Bertson,unavailable,Nail,85.55520000000001,False,Screw,7.327730000000001,False,Padlock,2.39704,False,1772,5955
1019,715342466308784130,2016-03-31 00:58:29,This is Oscar. He's a world renowned snowball inspector. It's a ruff job but someone has to do it. 10/10 great guy https://t.co/vSufMAKm3C,"https://twitter.com/dog_rates/status/715342466308784130/photo/1,https://twitter.com/dog_rates/status/715342466308784130/photo/1",10,10,Oscar,unavailable,West_Highland_White_Terrier,59.711099999999995,True,Soft-Coated_Wheaten_Terrier,14.2993,True,Lakeland_Terrier,13.6712,True,768,3294
1020,715220193576927233,2016-03-30 16:52:36,This is Nico. His selfie game is strong af. Excellent use of a sneaky tongue slip. 10/10 star material https://t.co/1OBdJkMOFx,https://twitter.com/dog_rates/status/715220193576927233/photo/1,10,10,Nico,unavailable,Chihuahua,58.40260000000001,True,Italian_Greyhound,37.7077,True,Boston_Bull,1.7400400000000003,True,736,2630
1021,715200624753819648,2016-03-30 15:34:51,This is Michelangelope. He's half coffee cup. Rare af. 12/10 would hug until someone stopped me https://t.co/tvVDY0G911,https://twitter.com/dog_rates/status/715200624753819648/photo/1,12,10,Michelangelope,unavailable,Chihuahua,95.6787,True,Beagle,0.838287,True,Labrador_Retriever,0.8344090000000001,True,2110,5578
1022,715009755312439296,2016-03-30 02:56:24,This is Siba. She's remarkably mobile. Very sleepy as well. 12/10 would happily transport https://t.co/TjnI33RE1i,https://twitter.com/dog_rates/status/715009755312439296/photo/1,12,10,Siba,unavailable,Dingo,31.090300000000003,False,Chihuahua,14.2288,True,Cardigan,10.394499999999999,True,1392,4550
1023,714982300363173890,2016-03-30 01:07:18,This is Calbert. He forgot to clear his Google search history. 9/10 rookie mistake Calbert https://t.co/jRm5J3YCmj,https://twitter.com/dog_rates/status/714982300363173890/photo/1,9,10,Calbert,unavailable,Brittany_Spaniel,94.4376,True,Beagle,2.54353,True,Ibizan_Hound,0.996204,True,1166,4094
1024,714962719905021952,2016-03-29 23:49:30,Just in case anyone's having a bad day. 12/10 would bounce with https://t.co/T9sgP9ttnQ,https://vine.co/v/inVtemLt9tE,12,10,None,unavailable,,,,,,,,,,4816,8028
1025,714957620017307648,2016-03-29 23:29:14,This is Curtis. He's an Albino Haberdasher. Terrified of dandelions. They really spook him up. 10/10 it'll be ok pup https://t.co/s8YcfZrWhK,https://twitter.com/dog_rates/status/714957620017307648/photo/1,10,10,Curtis,unavailable,Great_Pyrenees,25.151600000000002,True,Samoyed,13.9346,True,Kuvasz,12.900500000000001,True,1595,4503
1026,714631576617938945,2016-03-29 01:53:39,This is Benedict. He's a feisty pup. Needs a brushing. Portable af. Looks very angry actually. 4/10 might not pet https://t.co/3oeFfHjv0Z,https://twitter.com/dog_rates/status/714631576617938945/photo/1,4,10,Benedict,unavailable,Meerkat,14.349700000000002,False,Weasel,11.740200000000002,False,Black-Footed_Ferret,9.99327,False,1122,3571
1027,714606013974974464,2016-03-29 00:12:05,Here are two lil cuddly puppers. Both 12/10 would snug like so much https://t.co/zO4eb7C4tG,https://twitter.com/dog_rates/status/714606013974974464/photo/1,12,10,None,unavailable,Norfolk_Terrier,29.300700000000003,True,Labrador_Retriever,25.619799999999998,True,Golden_Retriever,12.964300000000001,True,1038,3938
1028,714485234495041536,2016-03-28 16:12:09,This is Blitz. He screams. 10/10 (vid by @yeaahliv) https://t.co/MfW2aym5UF,https://vine.co/v/iDrOvVqq0A6,10,10,Blitz,unavailable,,,,,,,,,,1313,2962
1029,714258258790387713,2016-03-28 01:10:13,"Meet Travis and Flurp. Travis is pretty chill but Flurp can't lie down properly. 10/10 &amp; 8/10
get it together Flurp https://t.co/Akzl5ynMmE",https://twitter.com/dog_rates/status/714258258790387713/photo/1,10,10,Travis,unavailable,Collie,17.6758,True,Chesapeake_Bay_Retriever,10.183399999999999,True,Beagle,10.1294,True,808,3281
1030,714251586676113411,2016-03-28 00:43:43,This is Thumas. He hates potted plants. 8/10 wtf Thumas https://t.co/rDVueNIcEi,"https://twitter.com/dog_rates/status/714251586676113411/photo/1,https://twitter.com/dog_rates/status/714251586676113411/photo/1",8,10,Thumas,unavailable,Soft-Coated_Wheaten_Terrier,75.1962,True,Bedlington_Terrier,17.5652,True,Great_Pyrenees,1.14524,True,940,3570
1031,714214115368108032,2016-03-27 22:14:49,Happy Easter from the squad! ðŸ‡ðŸ¶ 13/10 for all https://t.co/YMx4KWJUAB,https://twitter.com/dog_rates/status/714214115368108032/photo/1,13,10,None,unavailable,Pug,53.396699999999996,True,Bloodhound,16.4826,True,German_Shepherd,4.6524,True,990,2480
1032,714141408463036416,2016-03-27 17:25:54,"I know we only rate dogs, but since it's Easter I guess we could rate a bunny for a change. 10/10 petable as hell https://t.co/O2RlKXigHu",https://twitter.com/dog_rates/status/714141408463036416/photo/1,10,10,None,unavailable,Labrador_Retriever,58.6951,True,Golden_Retriever,37.8812,True,Redbone,0.360489,True,1569,4673
1033,713919462244790272,2016-03-27 02:43:58,This is Kanu. He's a Freckled Ticonderoga. Simply flawless. 12/10 would perform an elaborate heist to capture https://t.co/7vyAzIURrE,https://twitter.com/dog_rates/status/713919462244790272/photo/1,12,10,Kanu,unavailable,Siberian_Husky,46.3223,True,Eskimo_Dog,38.9959,True,Malamute,9.79627,True,869,3564
1034,713909862279876608,2016-03-27 02:05:49,This is Doug. His nose is legendary af. 12/10 (vid by @probably_trey) https://t.co/7IWKfbfihS,https://vine.co/v/iDWlapaXWmm,12,10,Doug,unavailable,,,,,,,,,,616,2078
1035,713761197720473600,2016-03-26 16:15:05,This is Piper. She would really like that tennis ball core. Super sneaky tongue slip. 12/10 precious af https://t.co/QP6GHi5az9,"https://twitter.com/dog_rates/status/713761197720473600/photo/1,https://twitter.com/dog_rates/status/713761197720473600/photo/1",12,10,Piper,unavailable,Brittany_Spaniel,79.7936,True,English_Springer,4.471819999999998,True,Welsh_Springer_Spaniel,3.79107,True,1541,5308
1036,713411074226274305,2016-03-25 17:03:49,Here we see an extremely rare Bearded Floofmallow. Only a few left in the wild. 11/10 would pet with a purpose https://t.co/jVJJKlPbvq,https://twitter.com/dog_rates/status/713411074226274305/photo/1,11,10,None,unavailable,Great_Pyrenees,72.0337,True,Samoyed,12.954200000000002,True,Kuvasz,12.2451,True,1440,4802
1037,713177543487135744,2016-03-25 01:35:51,This is Lance. Lance doesn't give a shit. 10/10 we should all be more like Lance https://t.co/SqnG9Ap28J,https://twitter.com/dog_rates/status/713177543487135744/photo/1,10,10,Lance,unavailable,Whippet,73.4244,True,Basenji,2.5947999999999998,True,Great_Dane,2.58743,True,3183,7854
1038,713175907180089344,2016-03-25 01:29:21,Say hello to Opie and Clarkus. Clarkus fell asleep so Opie buried him. Ruthless af 10/10 for both https://t.co/xT7XaY4gnW,https://twitter.com/dog_rates/status/713175907180089344/photo/1,10,10,Opie,unavailable,Timber_Wolf,50.3788,False,Malamute,43.062400000000004,True,Siberian_Husky,2.84542,True,1630,4851
1039,712809025985978368,2016-03-24 01:11:29,This is Stubert. He just arrived. 10/10 https://t.co/HVGs5aAKAn,https://twitter.com/dog_rates/status/712809025985978368/photo/1,10,10,Stubert,unavailable,Labrador_Retriever,86.86709999999998,True,Carton,9.50952,False,Pug,0.7651370000000001,True,7602,20378
1040,712717840512598017,2016-03-23 19:09:09,Please don't send in any more polar bears. We only rate dogs. Thank you... 10/10 https://t.co/83RGhdIQz2,https://twitter.com/dog_rates/status/712717840512598017/photo/1,10,10,None,unavailable,Great_Pyrenees,73.2043,True,Kuvasz,12.1375,True,Irish_Wolfhound,4.952369999999999,True,5616,13474
1041,712668654853337088,2016-03-23 15:53:42,Say hello to Sunny and Roxy. They pull things out of water together. 10/10 for both https://t.co/88aedAmxcl,"https://twitter.com/dog_rates/status/712668654853337088/photo/1,https://twitter.com/dog_rates/status/712668654853337088/photo/1,https://twitter.com/dog_rates/status/712668654853337088/photo/1",10,10,Sunny,unavailable,Labrador_Retriever,82.9058,True,Golden_Retriever,3.86645,True,Chihuahua,2.62214,True,1367,4531
1042,712438159032893441,2016-03-23 00:37:48,This is Kane. He's a semi-submerged Haitian Huffleplop. Happy af. Sick waterfall. 11/10 would pat head approvingly https://t.co/7zjEC501Ul,https://twitter.com/dog_rates/status/712438159032893441/photo/1,11,10,Kane,unavailable,Ice_Bear,86.94770000000001,False,Great_Pyrenees,6.9457,True,Labrador_Retriever,2.474,True,1756,5799
1043,712309440758808576,2016-03-22 16:06:19,"Reminder that we made our first set of stickers available! All are 12/10 would stick
Use code ""pupper"" at checkoutðŸ¶

https://t.co/kJIMNyMNKV",https://twitter.com/stickergrub/status/709919141004595201,12,10,None,pupper,,,,,,,,,,26,269
1044,712097430750289920,2016-03-22 02:03:52,I can't even comprehend how confused this dog must be right now. 10/10 https://t.co/8AGcQ4hIfK,https://twitter.com/dog_rates/status/712097430750289920/photo/1,10,10,None,unavailable,Labrador_Retriever,72.0481,True,Whippet,4.80318,True,Chesapeake_Bay_Retriever,4.50464,True,1172,4144
1045,712092745624633345,2016-03-22 01:45:15,This is Steven. He's inverted af. Also very helpful. Scans anything you want for free. Takes him a while tho. 7/10 https://t.co/tA0ZiQ7JcG,https://twitter.com/dog_rates/status/712092745624633345/photo/1,7,10,Steven,unavailable,Triceratops,23.5373,False,Llama,15.312600000000002,False,Three-Toed_Sloth,11.184,False,1016,3211
1046,712085617388212225,2016-03-22 01:16:55,"Say hello to Olive and Ruby. They are best buddies. Both 11/10 
1 like = 1 buddy https://t.co/yagmFdKlyL","https://twitter.com/dog_rates/status/712085617388212225/photo/1,https://twitter.com/dog_rates/status/712085617388212225/photo/1,https://twitter.com/dog_rates/status/712085617388212225/photo/1",11,10,Olive,unavailable,Shih-Tzu,62.5129,True,Tibetan_Terrier,12.6897,True,Lhasa,11.9663,True,556,3531
1047,712065007010385924,2016-03-21 23:55:01,This is Chester. He's clearly in charge of the other dogs. Weird ass paws. Not fit for fetch. 6/10 would still pet https://t.co/o2GvskrhHt,https://twitter.com/dog_rates/status/712065007010385924/photo/1,6,10,Chester,unavailable,Goose,21.4301,False,Gibbon,8.4253,False,Pizza,8.01683,False,700,2451
1048,711968124745228288,2016-03-21 17:30:03,Meet Winston. He's trapped in a cup of coffee. Poor pupper. 10/10 someone free him https://t.co/2e6cUtKUuc,https://twitter.com/dog_rates/status/711968124745228288/photo/1,10,10,Winston,pupper,Espresso,43.01350000000001,False,Coffee_Mug,41.8483,False,Cup,8.83912,False,2601,8776
1049,711743778164514816,2016-03-21 02:38:34,Meet Roosevelt. He's calculating the best case scenario if he drops out instead of doing math hw. 11/10 relatable af https://t.co/QcSIRDpfVg,https://twitter.com/dog_rates/status/711743778164514816/photo/1,11,10,Roosevelt,unavailable,Lakeland_Terrier,45.9515,True,Miniature_Poodle,21.9661,True,Standard_Poodle,13.0189,True,1101,3095
1050,711732680602345472,2016-03-21 01:54:29,I want to hear the joke this dog was just told. 10/10 https://t.co/1KiuZqqOD4,"https://twitter.com/dog_rates/status/711732680602345472/photo/1,https://twitter.com/dog_rates/status/711732680602345472/photo/1,https://twitter.com/dog_rates/status/711732680602345472/photo/1",10,10,None,unavailable,Dingo,36.6875,False,Ibizan_Hound,33.4929,True,Eskimo_Dog,7.387619999999999,True,4653,9756
1051,711694788429553666,2016-03-20 23:23:54,Oh. My. God. 13/10 magical af https://t.co/Ezu6jQrKAZ,https://twitter.com/dog_rates/status/711694788429553666/photo/1,13,10,None,unavailable,Brown_Bear,71.3293,False,Indian_Elephant,17.284399999999998,False,Water_Buffalo,3.89022,False,20500,35865
1052,711652651650457602,2016-03-20 20:36:28,This is Gary. He just wanted to say hi. 9/10 very personable pup https://t.co/Sk3CbhmKSW,https://twitter.com/dog_rates/status/711652651650457602/photo/1,9,10,Gary,unavailable,Llama,85.67889999999998,False,Arabian_Camel,9.8727,False,Neck_Brace,1.63772,False,1037,4228
1053,711363825979756544,2016-03-20 01:28:47,"""Please, no puparazzi"" 11/10 https://t.co/nJIXSPfedK","https://twitter.com/dog_rates/status/711363825979756544/photo/1,https://twitter.com/dog_rates/status/711363825979756544/photo/1",11,10,None,unavailable,Pembroke,75.09060000000001,True,Cardigan,24.1152,True,Basenji,0.26396200000000003,True,1287,3996
1054,711306686208872448,2016-03-19 21:41:44,What hooligan sent in pictures w/out a dog in them? Churlish af. 3/10 just bc that's a neat fluffy bean bag chair https://t.co/wcwoGOkZvz,"https://twitter.com/dog_rates/status/711306686208872448/photo/1,https://twitter.com/dog_rates/status/711306686208872448/photo/1",3,10,None,unavailable,Leatherback_Turtle,28.0835,False,Loggerhead,12.328999999999999,False,Dandie_Dinmont,8.67925,True,819,3596
1055,711008018775851008,2016-03-19 01:54:56,This is Chuckles. He had a balloon but he accidentally let go of it and it floated away. 11/10 hang in there pupper https://t.co/68iNM7B5gW,https://twitter.com/dog_rates/status/711008018775851008/photo/1,11,10,Chuckles,pupper,French_Bulldog,73.1405,True,Boston_Bull,15.0672,True,Pug,2.18109,True,710,3275
1056,710997087345876993,2016-03-19 01:11:29,Meet Milo and Amos. They are the best of pals. Both 12/10 would pet at the same time https://t.co/Mv37BHEyyD,https://twitter.com/dog_rates/status/710997087345876993/photo/1,12,10,Milo,unavailable,Malamute,28.126,True,Eskimo_Dog,23.2641,True,Pembroke,9.1602,True,1561,4960
1057,710844581445812225,2016-03-18 15:05:29,This is Staniel. His selfie game is strong af. 10/10 I'd snapchat with Staniel https://t.co/UgkTw7TKyM,https://twitter.com/dog_rates/status/710844581445812225/photo/1,10,10,Staniel,unavailable,Dingo,53.6593,False,Pembroke,20.0407,True,Basenji,6.073449999999999,True,779,2775
1058,710833117892898816,2016-03-18 14:19:56,Say hello to Sora. She's an Egyptian Pumpernickel. Mesmerizing af. 12/10 would bring home to mom https://t.co/PmTR4kxZkq,https://twitter.com/dog_rates/status/710833117892898816/photo/1,12,10,Sora,unavailable,Pembroke,80.3742,True,Cardigan,18.9712,True,German_Shepherd,0.17460900000000001,True,606,2937
1059,710609963652087808,2016-03-17 23:33:12,I've watched this a million times and you probably will too. 12/10 (vid by @emily_galasso) https://t.co/DU7Rb3NDiy,https://vine.co/v/idaTpwH5TgU,12,10,None,unavailable,,,,,,,,,,2624,5227
1060,710588934686908417,2016-03-17 22:09:38,This is Beemo. He's a Chubberflop mix. 12/10 would cross the world for https://t.co/kzMVMU8HBV,"https://twitter.com/dog_rates/status/710588934686908417/photo/1,https://twitter.com/dog_rates/status/710588934686908417/photo/1,https://twitter.com/dog_rates/status/710588934686908417/photo/1,https://twitter.com/dog_rates/status/710588934686908417/photo/1",12,10,Beemo,unavailable,Pembroke,98.2004,True,Cardigan,0.894347,True,Malamute,0.7549899999999998,True,2107,4968
1061,710296729921429505,2016-03-17 02:48:31,This is Oshie. 12/10 please enjoy (vid by @catherinec1389) https://t.co/VmtzwAuotq,https://vine.co/v/iw9hUFAMerV,12,10,Oshie,unavailable,,,,,,,,,,833,2574
1062,710283270106132480,2016-03-17 01:55:02,This is Gunner. He's a Figamus Newton. King of the peek-a-boo. Cool jeans. 11/10 https://t.co/ONuBILIYXZ,"https://twitter.com/dog_rates/status/710283270106132480/photo/1,https://twitter.com/dog_rates/status/710283270106132480/photo/1",11,10,Gunner,unavailable,Shih-Tzu,93.2401,True,Lhasa,3.08057,True,Tibetan_Terrier,0.8974279999999999,True,580,2308
1063,710272297844797440,2016-03-17 01:11:26,We ðŸ‘ðŸ» only ðŸ‘ðŸ» rate ðŸ‘ðŸ» dogs. Pls stop sending in non-canines like this Dutch Panda Worm. This is infuriating. 11/10 https://t.co/odfLzBonG2,https://twitter.com/dog_rates/status/710272297844797440/photo/1,11,10,infuriating,unavailable,Old_English_Sheepdog,58.630700000000004,True,Wire-Haired_Fox_Terrier,11.862200000000001,True,Lakeland_Terrier,10.6806,True,1425,4945
1064,710269109699739648,2016-03-17 00:58:46,"The squad is back for St. Patrick's Day! â˜˜ ðŸ’š
13/10 for all https://t.co/OcCDb2bng5",https://twitter.com/dog_rates/status/710269109699739648/photo/1,13,10,None,unavailable,Pug,41.5495,True,German_Shepherd,17.8157,True,Labrador_Retriever,10.020199999999999,True,1257,2613
1065,710153181850935296,2016-03-16 17:18:07,This is Lacy. She's tipping her hat to you. Daydreams of her life back on the frontier. 11/10 would pet so well https://t.co/fG5Pk3Et1I,"https://twitter.com/dog_rates/status/710153181850935296/photo/1,https://twitter.com/dog_rates/status/710153181850935296/photo/1",11,10,Lacy,unavailable,Cowboy_Hat,97.9053,False,Sombrero,1.06825,False,Cocker_Spaniel,0.271296,True,1006,3153
1066,710140971284037632,2016-03-16 16:29:35,This is Tater. His underbite is fierce af. Doesn't give a damn about your engagement photo. 8/10 https://t.co/nLuPY3pY12,https://twitter.com/dog_rates/status/710140971284037632/photo/1,8,10,Tater,unavailable,Pekinese,95.317,True,Papillon,1.95169,True,Japanese_Spaniel,0.582051,True,1008,3017
1067,710117014656950272,2016-03-16 14:54:24,This pupper got her hair chalked for her birthday. Hasn't told her parents yet. Rebellious af. 11/10 very nifty https://t.co/h1OX2mLtxV,"https://twitter.com/dog_rates/status/710117014656950272/photo/1,https://twitter.com/dog_rates/status/710117014656950272/photo/1",11,10,None,pupper,Toy_Poodle,80.20920000000001,True,Miniature_Poodle,11.1647,True,Cocker_Spaniel,6.28662,True,2233,5999
1068,709918798883774466,2016-03-16 01:46:45,Meet Watson. He's a Suzuki Tickleboop. Leader of a notorious biker gang. Only one ear functional. 12/10 snuggable af https://t.co/R1gLc5vDqG,"https://twitter.com/dog_rates/status/709918798883774466/photo/1,https://twitter.com/dog_rates/status/709918798883774466/photo/1",12,10,Watson,unavailable,Pembroke,95.6222,True,Cardigan,2.07273,True,Chihuahua,0.791218,True,1215,3250
