,tweet_id,timestamp,text,expanded_urls,rating_numerator,rating_denominator,name,good_dog_stage,p1,p1_conf,p1_dog,p2,p2_conf,p2_dog,p3,p3_conf,p3_dog,retweet_count,favorite_count
1505,680609293079592961,2015-12-26 04:41:15,This is Brody. That is his chair. He loves his chair. Never leaves it. 9/10 might be stuck actually https://t.co/WvJRg0XJit,https://twitter.com/dog_rates/status/680609293079592961/photo/1,9,10,Brody,unavailable,French_Bulldog,70.0764,True,Chihuahua,7.238960000000001,True,American_Staffordshire_Terrier,3.9618699999999984,True,816,2906
1506,680583894916304897,2015-12-26 03:00:19,This is Penny. Her tennis ball slowly rolled down her cone and into the pool. 8/10 bad things happen to good puppers https://t.co/YNWU7LeFgg,"https://twitter.com/dog_rates/status/680583894916304897/photo/1,https://twitter.com/dog_rates/status/680583894916304897/photo/1,https://twitter.com/dog_rates/status/680583894916304897/photo/1,https://twitter.com/dog_rates/status/680583894916304897/photo/1",8,10,Penny,unavailable,Tub,88.98010000000001,False,Bathtub,3.2351099999999993,False,Hippopotamus,1.41773,False,1514,3939
1507,680497766108381184,2015-12-25 21:18:05,Meet Percy. He's a Latvian Yuletide Heineken. Refuses to take off sweater. Kinda feisty. 12/10 would keep in pocket https://t.co/QGM5Fcuv7s,https://twitter.com/dog_rates/status/680497766108381184/photo/1,12,10,Percy,unavailable,Chihuahua,53.8354,True,Muzzle,8.42887,False,Ski_Mask,7.669010000000001,False,2162,4639
1508,680473011644985345,2015-12-25 19:39:43,"This is Hector. He thinks he's a hammer. Silly Hector. You're a pupper, not a hammer. 10/10 https://t.co/OdUFuZIXiI",https://twitter.com/dog_rates/status/680473011644985345/photo/1,10,10,Hector,pupper,Lakeland_Terrier,79.6694,True,West_Highland_White_Terrier,13.8709,True,Norwich_Terrier,1.6253399999999998,True,844,2778
1509,680440374763077632,2015-12-25 17:30:01,Merry Christmas. My gift to you is this tiny unicorn running into a wall in slow motion. 11/10 https://t.co/UKqIAnR3He,https://twitter.com/dog_rates/status/680440374763077632/video/1,11,10,None,unavailable,Space_Heater,92.03670000000001,False,Radiator,4.99332,False,Electric_Fan,0.671903,False,564,1583
1510,680221482581123072,2015-12-25 03:00:14,This is CeCe. She's patiently waiting for Santa. 10/10 https://t.co/ZJUypFFwvg,https://twitter.com/dog_rates/status/680221482581123072/photo/1,10,10,CeCe,unavailable,Bubble,24.0173,False,Hen,14.6222,False,Abaya,13.934199999999999,False,329,1598
1511,680206703334408192,2015-12-25 02:01:30,I hope everyone enjoys this picture as much as I do. This is Toby. 12/10 https://t.co/vHnu1g9EJm,https://twitter.com/dog_rates/status/680206703334408192/photo/1,12,10,Toby,unavailable,Christmas_Stocking,14.9758,False,Cloak,12.883,False,Teddy,10.9129,False,1323,3115
1512,680191257256136705,2015-12-25 01:00:07,Here's a sleepy Christmas pupper 11/10 https://t.co/KXg0f8GNQ9,https://twitter.com/dog_rates/status/680191257256136705/photo/1,11,10,None,pupper,Brittany_Spaniel,73.3253,True,Welsh_Springer_Spaniel,25.163400000000003,True,English_Springer,0.924321,True,577,2356
1513,680176173301628928,2015-12-25 00:00:11,This pupper is patiently waiting to scare the shit out of Santa. 10/10 https://t.co/NhXo67K6yt,https://twitter.com/dog_rates/status/680176173301628928/photo/1,10,10,None,pupper,Christmas_Stocking,20.7547,False,Mask,19.387999999999998,False,Feather_Boa,15.273800000000001,False,1760,4263
1514,680161097740095489,2015-12-24 23:00:17,Meet Goliath. He's an example of irony. Head is phenomenally round. Wants to be an ornament. 12/10 would hug gently https://t.co/72Dil0Aktw,https://twitter.com/dog_rates/status/680161097740095489/photo/1,12,10,Goliath,unavailable,Bluetick,26.868100000000002,True,Miniature_Pinscher,12.5652,True,English_Setter,8.93727,True,828,2538
1515,680145970311643136,2015-12-24 22:00:10,Say hello to Kawhi. He was doing fine until his hat fell off. He got it back though. 10/10 deep breaths pupper https://t.co/N5pM6WBx7e,"https://twitter.com/dog_rates/status/680145970311643136/photo/1,https://twitter.com/dog_rates/status/680145970311643136/photo/1,https://twitter.com/dog_rates/status/680145970311643136/photo/1",10,10,Kawhi,pupper,Miniature_Poodle,45.7117,True,Toy_Poodle,22.6481,True,Maltese_Dog,6.76815,True,1972,3955
1516,680130881361686529,2015-12-24 21:00:12,This is Reggie. His Santa hat is a little big. 10/10 he's still having fun https://t.co/w0dcGXq7qK,https://twitter.com/dog_rates/status/680130881361686529/photo/1,10,10,Reggie,unavailable,Maltese_Dog,19.9121,True,West_Highland_White_Terrier,19.7897,True,Shih-Tzu,15.713,True,1078,2519
1517,680115823365742593,2015-12-24 20:00:22,This is Ozzy. He woke up 2 minutes before he had to be ready for the Christmas party. 9/10 classic Ozzy https://t.co/Kt9vmw0Fap,https://twitter.com/dog_rates/status/680115823365742593/photo/1,9,10,Ozzy,unavailable,Pug,99.9365,True,French_Bulldog,0.0543615,True,Boston_Bull,0.0028152800000000007,True,1028,2972
1518,680100725817409536,2015-12-24 19:00:23,This pupper is not coming inside until she catches a snowflake on her tongue. 11/10 the determination is palpable https://t.co/lvMYbmKq8H,https://twitter.com/dog_rates/status/680100725817409536/photo/1,11,10,None,pupper,Golden_Retriever,69.89609999999999,True,Chow,14.597100000000001,True,Pomeranian,3.4888000000000003,True,1554,3891
1519,680085611152338944,2015-12-24 18:00:19,This is by far the most coordinated series of pictures I was sent. Downright impressive in every way. 12/10 for all https://t.co/etzLo3sdZE,"https://twitter.com/dog_rates/status/680085611152338944/photo/1,https://twitter.com/dog_rates/status/680085611152338944/photo/1,https://twitter.com/dog_rates/status/680085611152338944/photo/1",12,10,by,unavailable,Pillow,77.8113,False,Apron,9.50228,False,Wallet,4.932580000000001,False,10034,13959
1520,680070545539371008,2015-12-24 17:00:27,Say hello to Emmie. She's trapped in an ornament. Tragic af. Looks pretty content tho. Maybe it's meant to be. 9/10 https://t.co/Fh7geodBCU,https://twitter.com/dog_rates/status/680070545539371008/photo/1,9,10,Emmie,unavailable,Earthstar,12.770100000000001,False,Shih-Tzu,12.1811,True,Bubble,11.782,False,994,2818
1521,680055455951884288,2015-12-24 16:00:30,"Meet Sammy. At first I was like ""that's a snowflake. we only rate dogs,"" but he would've melted by now, so 10/10 https://t.co/MQfPK4zwuh",https://twitter.com/dog_rates/status/680055455951884288/photo/1,10,10,Sammy,unavailable,Samoyed,99.5466,True,Great_Pyrenees,0.183395,True,Pomeranian,0.06669489999999999,True,8067,18278
1522,679877062409191424,2015-12-24 04:11:37,Meet Penelope. She's a bacon frise. Total babe (lol get it like the movie). Doesn't bark tho. 5/10 very average dog https://t.co/SDcQYg0HSZ,https://twitter.com/dog_rates/status/679877062409191424/photo/1,5,10,Penelope,unavailable,Hog,80.9466,False,Hay,6.017779999999999,False,Lumbermill,1.64834,False,726,2155
1523,679872969355714560,2015-12-24 03:55:21,This is Rocco. He's in a very intense game of freeze tag. Currently waiting to be unfrozen 10/10 https://t.co/xZXUKVXJ7l,https://vine.co/v/iAAxTbj1UAM,10,10,Rocco,unavailable,,,,,,,,,,749,2365
1524,679862121895714818,2015-12-24 03:12:15,"""Dammit hooman I'm jus trynna lik the fler"" 11/10 https://t.co/eRZRI8OTj7",https://twitter.com/dog_rates/status/679862121895714818/photo/1,11,10,None,unavailable,Entlebucher,52.320600000000006,True,Greater_Swiss_Mountain_Dog,43.1657,True,Appenzeller,4.42079,True,706,2678
1525,679854723806179328,2015-12-24 02:42:51,This is Bruce. He's a rare pup. Covered in Frosted Flakes. Nifty gold teeth. Overall good dog. 7/10 would pet firmly https://t.co/RtxxACzZ8A,https://twitter.com/dog_rates/status/679854723806179328/photo/1,7,10,Bruce,unavailable,Llama,88.79629999999999,False,Ram,9.50207,False,Chow,0.230739,True,1402,3143
1526,679844490799091713,2015-12-24 02:02:12,This is Willie. He's floating away and needs your assistance. Please someone help Willie. 10/10 https://t.co/MJqygWqt8X,https://twitter.com/dog_rates/status/679844490799091713/photo/1,10,10,Willie,unavailable,Airedale,90.3832,True,Border_Terrier,3.4712600000000005,True,Toy_Poodle,2.1378,True,887,2593
1527,679828447187857408,2015-12-24 00:58:27,Everybody look at this beautiful pupper 13/10 https://t.co/hyAC5Hq9GC,"https://twitter.com/dog_rates/status/679828447187857408/photo/1,https://twitter.com/dog_rates/status/679828447187857408/photo/1,https://twitter.com/dog_rates/status/679828447187857408/photo/1",13,10,None,pupper,Chihuahua,34.6545,True,Dalmatian,16.6246,True,Toy_Terrier,11.7502,True,15839,39726
1528,679777920601223168,2015-12-23 21:37:40,This is Rinna. She's melting. 10/10 get inside pupper https://t.co/PA0czwucsb,https://twitter.com/dog_rates/status/679777920601223168/photo/1,10,10,Rinna,pupper,Bloodhound,52.881899999999995,True,Bull_Mastiff,42.011900000000004,True,French_Bulldog,0.9480590000000001,True,1281,3390
1529,679736210798047232,2015-12-23 18:51:56,This pup's name is Sabertooth (parents must be cool). Ears for days. Jumps unannounced. 9/10 would pet diligently https://t.co/iazoiNUviP,https://twitter.com/dog_rates/status/679736210798047232/photo/1,9,10,None,unavailable,French_Bulldog,31.9139,True,Chihuahua,15.4088,True,Cardigan,11.7688,True,918,2311
1530,679729593985699840,2015-12-23 18:25:38,This is Hunter. He was playing with his ball minding his own business. Has no idea what happened to the carpet. 8/10 https://t.co/DbUTDI3u1R,https://twitter.com/dog_rates/status/679729593985699840/photo/1,8,10,Hunter,unavailable,Wallaby,16.4215,False,West_Highland_White_Terrier,9.351479999999999,True,Ashcan,6.72783,False,937,2367
1531,679722016581222400,2015-12-23 17:55:32,This is Mike. He is a Jordanian Frito Pilates. Frowning because he can't see directly in front of him. 8/10 https://t.co/NL5QJwdEpF,https://twitter.com/dog_rates/status/679722016581222400/photo/1,8,10,Mike,unavailable,Boxer,45.9604,True,Boston_Bull,19.7913,True,French_Bulldog,8.70225,True,539,1817
1532,679530280114372609,2015-12-23 05:13:38,Guys this really needs to stop. We've been over this way too many times. This is a giraffe. We only rate dogs.. 7/10 https://t.co/yavgkHYPOC,https://twitter.com/dog_rates/status/679530280114372609/photo/1,7,10,a,unavailable,Dalmatian,75.0256,True,Jaguar,16.9007,False,Zebra,0.6481490000000001,False,2347,5208
1533,679527802031484928,2015-12-23 05:03:47,This little pupper just arrived. 11/10 would snug https://t.co/DA5aqnSGfB,https://twitter.com/dog_rates/status/679527802031484928/photo/1,11,10,None,pupper,Mailbox,33.6393,False,Cannon,15.8936,False,Cuirass,5.26471,False,823,2892
1534,679511351870550016,2015-12-23 03:58:25,Say hello to William. He makes fun of others because he's terrified of his own deep-seated insecurities. 7/10 https://t.co/bwuV6FlRxr,https://twitter.com/dog_rates/status/679511351870550016/photo/1,7,10,William,unavailable,Chihuahua,76.1972,True,Black-Footed_Ferret,15.0605,False,Squirrel_Monkey,2.814790000000001,False,1461,3711
1535,679503373272485890,2015-12-23 03:26:43,This is Dwight. He's a pointy pupper. Very docile. Attracts marshmallows. Hurts to pet but definitely worth it 8/10 https://t.co/jjW7zTxY9Z,https://twitter.com/dog_rates/status/679503373272485890/photo/1,8,10,Dwight,pupper,Porcupine,99.9846,False,Meerkat,0.007191479999999999,False,Echidna,0.00444729,False,1673,3484
1536,679475951516934144,2015-12-23 01:37:45,This is Evy. She doesn't want to be a Koala. 9/10 https://t.co/VITeF0Kl9L,https://twitter.com/dog_rates/status/679475951516934144/photo/1,9,10,Evy,unavailable,Maltese_Dog,14.574200000000001,True,Toy_Poodle,13.9407,True,West_Highland_White_Terrier,10.8821,True,728,2304
1537,679462823135686656,2015-12-23 00:45:35,Meet Hurley. He's the curly one. He hugs every other dog he sees during his walk. 11/10 for spreading the love https://t.co/M6vqkt2GKV,https://twitter.com/dog_rates/status/679462823135686656/photo/1,11,10,Hurley,unavailable,Toy_Poodle,62.178,True,Miniature_Poodle,19.7819,True,Soft-Coated_Wheaten_Terrier,4.6745,True,21324,34856
1538,679405845277462528,2015-12-22 20:59:10,Crazy unseen footage from Jurassic Park. 10/10 for both dinosaur puppers https://t.co/L8wt2IpwxO,https://vine.co/v/iKVFEigMLxP,10,10,None,unavailable,,,,,,,,,,1364,2594
1539,679158373988876288,2015-12-22 04:35:49,This is Rubio. He has too much skin. 11/10 https://t.co/NLOHmlENag,https://twitter.com/dog_rates/status/679158373988876288/photo/1,11,10,Rubio,unavailable,Pug,27.2205,True,Bull_Mastiff,25.153000000000002,True,Bath_Towel,11.6806,False,9193,23568
1540,679148763231985668,2015-12-22 03:57:37,I know everyone's excited for Christmas but that doesn't mean you can send in reindeer. We only rate dogs... 8/10 https://t.co/eWjWgbOCYL,https://twitter.com/dog_rates/status/679148763231985668/photo/1,8,10,None,unavailable,Italian_Greyhound,30.2685,True,Hair_Slide,12.4281,False,Afghan_Hound,5.9846,True,1163,3028
1541,679132435750195208,2015-12-22 02:52:45,This is Louis. He's a river dancer. His friends think it's badass. All are very supportive. 10/10 for Louis https://t.co/qoIvjKMY58,https://twitter.com/dog_rates/status/679132435750195208/photo/1,10,10,Louis,unavailable,Scottish_Deerhound,19.461000000000002,True,Irish_Wolfhound,16.2855,True,Giant_Schnauzer,15.983699999999997,True,1314,3253
1542,679111216690831360,2015-12-22 01:28:25,This is officially the greatest yawn of all time. 12/10 https://t.co/4R0Cc0sLVE,https://twitter.com/dog_rates/status/679111216690831360/video/1,12,10,officially,unavailable,Kelpie,18.9423,True,Beagle,12.1988,True,Basset,12.1171,True,2893,6514
1543,679062614270468097,2015-12-21 22:15:18,This is Chompsky. He lives up to his name. 11/10 https://t.co/Xl37lQEWd0,"https://twitter.com/dog_rates/status/679062614270468097/photo/1,https://twitter.com/dog_rates/status/679062614270468097/photo/1",11,10,Chompsky,unavailable,Cash_Machine,80.2333,False,Schipperke,4.55186,True,German_Shepherd,2.33535,True,9299,18712
1544,679047485189439488,2015-12-21 21:15:11,This dog doesn't know how to stairs. Quite tragic really. 9/10 get it together pup https://t.co/kTpr9PTMg1,https://twitter.com/dog_rates/status/679047485189439488/photo/1,9,10,None,unavailable,Panpipe,96.2572,False,Bannister,2.52482,False,Golden_Retriever,0.293035,True,781,2460
1545,679001094530465792,2015-12-21 18:10:50,This is Rascal. He's paddling an imaginary canoe. 11/10 https://t.co/Ajquq6oGSg,https://vine.co/v/iKIwAzEatd6,11,10,Rascal,unavailable,,,,,,,,,,1378,3075
1546,678991772295516161,2015-12-21 17:33:48,If your Monday isn't going so well just take a look at this. Both 12/10 https://t.co/GJT6SILPGU,https://twitter.com/dog_rates/status/678991772295516161/photo/1,12,10,None,unavailable,Eskimo_Dog,33.0216,True,Siberian_Husky,18.7003,True,Chihuahua,10.142,True,1333,2537
1547,678969228704284672,2015-12-21 16:04:13,Meet Lola. She's a Metamorphic Chartreuse. Plays with her food. Insubordinate and churlish. Exquisite hardwood 11/10 https://t.co/etpBNXwN7f,https://twitter.com/dog_rates/status/678969228704284672/photo/1,11,10,Lola,unavailable,Labrador_Retriever,68.02510000000001,True,Chesapeake_Bay_Retriever,20.1697,True,Golden_Retriever,1.9675900000000004,True,528,1796
1548,678800283649069056,2015-12-21 04:52:53,Here's a pupper with some mean tan lines. Snazzy sweater though 12/10 https://t.co/DpCSVsl6vu,https://twitter.com/dog_rates/status/678800283649069056/photo/1,12,10,None,pupper,Labrador_Retriever,21.3673,True,Beagle,14.6235,True,Airedale,12.270100000000001,True,1018,2810
1549,678798276842360832,2015-12-21 04:44:55,This is Linda. She fucking hates trees. 7/10 https://t.co/blaY85FIxR,https://twitter.com/dog_rates/status/678798276842360832/photo/1,7,10,Linda,unavailable,Airedale,58.312200000000004,True,Silky_Terrier,12.956700000000001,True,Lakeland_Terrier,9.47266,True,1350,3804
1550,678774928607469569,2015-12-21 03:12:08,This is Tug. He's not required to wear the cone he just wants his voice to project more clearly. 11/10 https://t.co/Sp739Ou2qx,https://twitter.com/dog_rates/status/678774928607469569/photo/1,11,10,Tug,unavailable,Pembroke,19.4681,True,Toy_Poodle,12.1821,True,Pomeranian,9.6843,True,1043,3037
1551,678767140346941444,2015-12-21 02:41:11,This is Mia. She makes awful decisions. 8/10 https://t.co/G6TQVgTcZz,https://twitter.com/dog_rates/status/678767140346941444/photo/1,8,10,Mia,unavailable,Harp,82.11200000000001,False,Window_Screen,2.51208,False,Mosquito_Net,1.6715599999999997,False,1553,3864
1552,678764513869611008,2015-12-21 02:30:45,"Meet Wilson. He got caught humping the futon. He's like ""dude, help me out here"" 10/10 I'd help Wilson out https://t.co/m6XoclB0qv",https://twitter.com/dog_rates/status/678764513869611008/photo/1,10,10,Wilson,unavailable,Irish_Terrier,69.6646,True,Australian_Terrier,7.496160000000001,True,Irish_Setter,6.39012,True,544,1788
1553,678755239630127104,2015-12-21 01:53:54,This is Dash. He didn't think the water would be that cold. Damn it Dash it's December. Think a little. 10/10 https://t.co/NqcOwG8pxW,https://twitter.com/dog_rates/status/678755239630127104/photo/1,10,10,Dash,unavailable,Malamute,60.665400000000005,True,Border_Collie,19.3831,True,Collie,4.83781,True,3741,7802
1554,678740035362037760,2015-12-21 00:53:29,Meet Tango. He's a large dog. Doesn't care much for personal space. Owner isn't very accepting. Tongue slip. 6/10 https://t.co/p2T5kGebxe,https://twitter.com/dog_rates/status/678740035362037760/photo/1,6,10,Tango,unavailable,Seat_Belt,78.71640000000001,False,Sunglasses,4.5738699999999985,False,Beagle,2.25251,True,1926,4099
1555,678708137298427904,2015-12-20 22:46:44,Here we are witnessing a wild field pupper. Lost his wallet in there. Rather unfortunate. 10/10 good luck pup https://t.co/sZy9Co74Bw,https://vine.co/v/eQjxxYaQ60K,10,10,None,pupper,,,,,,,,,,2753,6082
1556,678675843183484930,2015-12-20 20:38:24,Exotic pup here. Tail long af. Throat looks swollen. Might breathe fire. Exceptionally unfluffy 2/10 would still pet https://t.co/a8SqCaSo2r,https://twitter.com/dog_rates/status/678675843183484930/photo/1,2,10,None,unavailable,Maze,33.985,False,Streetcar,9.968779999999999,False,Sundial,8.48077,False,1680,3155
1557,678643457146150913,2015-12-20 18:29:43,Meet Grizz. He just arrived. Couldn't wait until Christmas. Worried bc he saw the swastikas on the carpet. 10/10 https://t.co/QBGwYrT7rv,https://twitter.com/dog_rates/status/678643457146150913/photo/1,10,10,Grizz,unavailable,Labrador_Retriever,33.8757,True,Flat-Coated_Retriever,30.447000000000003,True,Chest,9.33923,False,489,2250
1558,678446151570427904,2015-12-20 05:25:42,Touching scene here. Really stirs up the emotions. The bond between father &amp; son. So beautiful. 10/10 for both pups https://t.co/AJWJHov5gx,https://twitter.com/dog_rates/status/678446151570427904/photo/1,10,10,None,unavailable,Staffordshire_Bullterrier,28.4492,True,Rottweiler,18.9434,True,American_Staffordshire_Terrier,18.942999999999998,True,1785,4358
1559,678424312106393600,2015-12-20 03:58:55,This is Crystal. She's a shitty fireman. No sense of urgency. People could be dying Crystal. 2/10 just irresponsible https://t.co/rtMtjSl9pz,https://twitter.com/dog_rates/status/678424312106393600/photo/1,2,10,Crystal,unavailable,Maltese_Dog,75.9945,True,Toy_Poodle,10.1194,True,Shih-Tzu,5.60374,True,2880,5916
1560,678410210315247616,2015-12-20 03:02:53,Say hello to Jerome. He can shoot french fries out of his mouth at insane speeds. Deadly af. 10/10 https://t.co/dIy88HwrX8,https://twitter.com/dog_rates/status/678410210315247616/photo/1,10,10,Jerome,unavailable,Schipperke,14.5877,True,Labrador_Retriever,9.83538,True,Kelpie,9.73934,True,2072,4640
1561,678399652199309312,2015-12-20 02:20:55,This made my day. 12/10 please enjoy https://t.co/VRTbo3aAcm,https://twitter.com/dog_rates/status/678399652199309312/video/1,12,10,None,unavailable,Swing,92.9196,False,Bedlington_Terrier,1.50472,True,Great_Pyrenees,1.40389,True,30742,61794
1562,678396796259975168,2015-12-20 02:09:34,These little fellas have opposite facial expressions. Both 12/10 https://t.co/LmThv0GWen,"https://twitter.com/dog_rates/status/678396796259975168/photo/1,https://twitter.com/dog_rates/status/678396796259975168/photo/1",12,10,None,unavailable,Pembroke,95.61800000000001,True,Cardigan,3.18031,True,Chihuahua,0.62765,True,478,1731
1563,678389028614488064,2015-12-20 01:38:42,"This is Bella. She just learned that her final grade in chem was a 92.49 
poor pupper 11/10 https://t.co/auOoKuoveM",https://twitter.com/dog_rates/status/678389028614488064/photo/1,11,10,Bella,pupper,Miniature_Pinscher,51.6284,True,Kelpie,22.740199999999998,True,Vizsla,10.3246,True,473,2044
1564,678380236862578688,2015-12-20 01:03:46,This is Crumpet. He underestimated the snow. Quickly retreating. 10/10 https://t.co/a0Zx5LDFZa,https://twitter.com/dog_rates/status/678380236862578688/photo/1,10,10,Crumpet,unavailable,Dogsled,8.854,False,Snowmobile,5.7291,False,Samoyed,4.76014,True,1020,2655
1565,678341075375947776,2015-12-19 22:28:09,This pupper likes tape. 12/10 https://t.co/cSp6w5GWgm,https://twitter.com/dog_rates/status/678341075375947776/photo/1,12,10,None,pupper,Golden_Retriever,85.3284,True,Cocker_Spaniel,2.62298,True,Labrador_Retriever,2.41228,True,612,1896
1566,678334497360859136,2015-12-19 22:02:01,This is Rosie. She has a snazzy bow tie and a fin for a tail. Probably super fast underwater. Cool socks 10/10 https://t.co/GO76MdGBs0,https://twitter.com/dog_rates/status/678334497360859136/photo/1,10,10,Rosie,unavailable,Norfolk_Terrier,37.8643,True,Golden_Retriever,9.559389999999999,True,Kelpie,8.53092,True,304,1427
1567,678278586130948096,2015-12-19 18:19:51,Another spooky pupper here. Most definitely floating. No legs. Probably knows some dark magic. 10/10 very spooked https://t.co/JK8MByRzgj,https://twitter.com/dog_rates/status/678278586130948096/photo/1,10,10,None,pupper,Maltese_Dog,89.7841,True,Lhasa,3.5717499999999998,True,Tibetan_Terrier,1.7107499999999998,True,6857,12531
1568,678255464182861824,2015-12-19 16:47:58,This is Jessifer. She is a Bismoth Teriyaki. Flowers being attacked by hurricanes on bandana (rad). 9/10 stellar pup https://t.co/nZhmRwZzWv,https://twitter.com/dog_rates/status/678255464182861824/photo/1,9,10,Jessifer,unavailable,Chihuahua,61.3819,True,Yorkshire_Terrier,12.793099999999999,True,Pomeranian,6.212430000000001,True,418,1726
1569,678023323247357953,2015-12-19 01:25:31,After getting lost in Reese's eyes for several minutes we're going to upgrade him to a 13/10,,13,10,None,unavailable,,,,,,,,,,439,2095
1570,678021115718029313,2015-12-19 01:16:45,This is Reese. He likes holding hands. 12/10 https://t.co/cbLroGCbmh,https://twitter.com/dog_rates/status/678021115718029313/photo/1,12,10,Reese,unavailable,Miniature_Pinscher,82.2048,True,Doberman,9.60845,True,Rottweiler,3.2709300000000003,True,7148,15018
1571,677961670166224897,2015-12-18 21:20:32,This is Izzy. She's showing off the dance moves she's been working on. 11/10 I guess hard work pays off https://t.co/4JS92YAxTi,https://vine.co/v/iKuMDuYV0aZ,11,10,Izzy,unavailable,,,,,,,,,,1879,3701
1572,677918531514703872,2015-12-18 18:29:07,"""Everything looks pretty good in there. Make sure to brush your gums. Been flossing? How's school going?"" Both 10/10 https://t.co/lWL2IMJqLR",https://twitter.com/dog_rates/status/677918531514703872/photo/1,10,10,None,unavailable,Eskimo_Dog,19.9347,True,Dalmatian,15.3225,True,American_Staffordshire_Terrier,10.7798,True,463,1476
1573,677895101218201600,2015-12-18 16:56:01,Guys this was terrifying. Really spooked me up. We don't rate ghosts. We rate dogs. Please only send dogs... 9/10 https://t.co/EJImi1udYb,https://twitter.com/dog_rates/status/677895101218201600/photo/1,9,10,None,unavailable,Dalmatian,55.0702,True,Kuvasz,6.02264,True,Great_Pyrenees,5.8631,True,2384,5275
1574,677700003327029250,2015-12-18 04:00:46,This is Ralph. He's an interpretive dancer. 10/10 https://t.co/zoDdPyPFsa,https://twitter.com/dog_rates/status/677700003327029250/photo/1,10,10,Ralph,unavailable,Siberian_Husky,12.0849,True,Junco,7.92056,False,Malamute,6.308750000000001,True,1622,3689
1575,677698403548192770,2015-12-18 03:54:25,This is Sadie. She got her holidays confused. 9/10 damn it Sadie https://t.co/fm7HxOsuPK,https://twitter.com/dog_rates/status/677698403548192770/photo/1,9,10,Sadie,unavailable,Shih-Tzu,91.6645,True,Lhasa,5.788340000000002,True,Pekinese,2.01258,True,363,1332
1576,677687604918272002,2015-12-18 03:11:30,This was Cindy's face when she heard Susan forgot the snacks for after the kid's soccer game. 11/10 https://t.co/gzkuVGRgAD,https://twitter.com/dog_rates/status/677687604918272002/photo/1,11,10,None,unavailable,Pembroke,57.3047,True,Sunglasses,12.675799999999999,False,Golden_Retriever,10.8047,True,950,2681
1577,677673981332312066,2015-12-18 02:17:22,Endangered triangular pup here. Could be a wizard. Caught mid-laugh. No legs. Just fluff. Probably a wizard. 9/10 https://t.co/GFVIHIod0Z,https://twitter.com/dog_rates/status/677673981332312066/photo/1,9,10,None,unavailable,Maltese_Dog,81.79079999999999,True,Angora,7.7805100000000005,False,Pomeranian,2.21842,True,1677,3603
1578,677662372920729601,2015-12-18 01:31:14,"In honor of the new Star Wars movie. Here's Yoda pug. 12/10 pet really well, would I https://t.co/pvjdRn00XH",https://twitter.com/dog_rates/status/677662372920729601/photo/1,12,10,None,unavailable,Cowboy_Hat,25.611,False,Trench_Coat,12.708599999999997,False,Cloak,7.143889999999999,False,1101,2134
1579,677644091929329666,2015-12-18 00:18:36,This is a dog swinging. I really enjoyed it so I hope you all do as well. 11/10 https://t.co/Ozo9KHTRND,https://twitter.com/dog_rates/status/677644091929329666/video/1,11,10,a,unavailable,Chihuahua,62.6236,True,Italian_Greyhound,12.848300000000002,True,Swing,5.98404,False,886,2040
