,tweet_id,timestamp,text,expanded_urls,rating_numerator,rating_denominator,name,good_dog_stage,p1,p1_conf,p1_dog,p2,p2_conf,p2_dog,p3,p3_conf,p3_dog,retweet_count,favorite_count
0,892420643555336193,2017-08-01 16:23:56,This is Phineas. He's a mystical boy. Only ever appears in the hole of a donut. 13/10 https://t.co/MgUWQ76dJU,https://twitter.com/dog_rates/status/892420643555336193/photo/1,13,10,Phineas,unavailable,Orange,9.70486,False,Bagel,8.585110000000002,False,Banana,7.611,False,8853,39467
1,892177421306343426,2017-08-01 00:17:27,"This is Tilly. She's just checking pup on you. Hopes you're doing ok. If not, she's available for pats, snugs, boops, the whole bit. 13/10 https://t.co/0Xxu71qeIV",https://twitter.com/dog_rates/status/892177421306343426/photo/1,13,10,Tilly,unavailable,Chihuahua,32.3581,True,Pekinese,9.06465,True,Papillon,6.89569,True,6514,33819
2,891815181378084864,2017-07-31 00:18:03,This is Archie. He is a rare Norwegian Pouncing Corgo. Lives in the tall grass. You never know when one may strike. 12/10 https://t.co/wUnZnhtVJB,https://twitter.com/dog_rates/status/891815181378084864/photo/1,12,10,Archie,unavailable,Chihuahua,71.60119999999999,True,Malamute,7.8253,True,Kelpie,3.13789,True,4328,25461
3,891689557279858688,2017-07-30 15:58:51,This is Darla. She commenced a snooze mid meal. 13/10 happens to the best of us https://t.co/tD36da7qLQ,https://twitter.com/dog_rates/status/891689557279858688/photo/1,13,10,Darla,unavailable,Paper_Towel,17.0278,False,Labrador_Retriever,16.808600000000002,True,Spatula,4.08359,False,8964,42908
4,891327558926688256,2017-07-29 16:00:24,"This is Franklin. He would like you to stop calling him ""cute."" He is a very fierce shark and should be respected as such. 12/10 #BarkWeek https://t.co/AtUZn91f7f","https://twitter.com/dog_rates/status/891327558926688256/photo/1,https://twitter.com/dog_rates/status/891327558926688256/photo/1",12,10,Franklin,unavailable,Basset,55.5712,True,English_Springer,22.576999999999998,True,German_Short-Haired_Pointer,17.521900000000002,True,9774,41048
5,891087950875897856,2017-07-29 00:08:17,Here we have a majestic great white breaching off South Africa's coast. Absolutely h*ckin breathtaking. 13/10 (IG: tucker_marlo) #BarkWeek https://t.co/kQ04fDDRmh,https://twitter.com/dog_rates/status/891087950875897856/photo/1,13,10,None,unavailable,Chesapeake_Bay_Retriever,42.5595,True,Irish_Terrier,11.6317,True,Indian_Elephant,7.690219999999999,False,3261,20562
6,890971913173991426,2017-07-28 16:27:12,"Meet Jax. He enjoys ice cream so much he gets nervous around it. 13/10 help Jax enjoy more things by clicking below

https://t.co/Zr4hWfAs1H https://t.co/tVJBRMnhxl","https://gofundme.com/ydvmve-surgery-for-jax,https://twitter.com/dog_rates/status/890971913173991426/photo/1",13,10,Jax,unavailable,Appenzeller,34.170300000000005,True,Border_Collie,19.9287,True,Ice_Lolly,19.3548,False,2158,12041
7,890729181411237888,2017-07-28 00:22:40,When you watch your owner call another dog a good boy but then they turn back to you and say you're a great boy. 13/10 https://t.co/v0nONBcwxq,"https://twitter.com/dog_rates/status/890729181411237888/photo/1,https://twitter.com/dog_rates/status/890729181411237888/photo/1",13,10,None,unavailable,Pomeranian,56.614200000000004,True,Eskimo_Dog,17.8406,True,Pembroke,7.65069,True,16716,56848
8,890609185150312448,2017-07-27 16:25:51,This is Zoey. She doesn't want to be one of the scary sharks. Just wants to be a snuggly pettable boatpet. 13/10 #BarkWeek https://t.co/9TwLuAGH0b,https://twitter.com/dog_rates/status/890609185150312448/photo/1,13,10,Zoey,unavailable,Irish_Terrier,48.757400000000004,True,Irish_Setter,19.3054,True,Chesapeake_Bay_Retriever,11.8184,True,4429,28226
9,890240255349198849,2017-07-26 15:59:51,This is Cassie. She is a college pup. Studying international doggo communication and stick theory. 14/10 so elegant much sophisticate https://t.co/t1bfwz5S2A,https://twitter.com/dog_rates/status/890240255349198849/photo/1,14,10,Cassie,doggo,Pembroke,51.131899999999995,True,Cardigan,45.1038,True,Chihuahua,2.92482,True,7711,32467
10,890006608113172480,2017-07-26 00:31:25,This is Koda. He is a South Australian deckshark. Deceptively deadly. Frighteningly majestic. 13/10 would risk a petting #BarkWeek https://t.co/dVPW0B0Mme,"https://twitter.com/dog_rates/status/890006608113172480/photo/1,https://twitter.com/dog_rates/status/890006608113172480/photo/1",13,10,Koda,unavailable,Samoyed,95.7979,True,Pomeranian,1.38835,True,Chow,0.8167479999999999,True,7624,31166
11,889880896479866881,2017-07-25 16:11:53,This is Bruno. He is a service shark. Only gets out of the water to assist you. 13/10 terrifyingly good boy https://t.co/u1XPQMl29g,https://twitter.com/dog_rates/status/889880896479866881/photo/1,13,10,Bruno,unavailable,French_Bulldog,37.7417,True,Labrador_Retriever,15.1317,True,Muzzle,8.29811,False,5156,28268
12,889665388333682689,2017-07-25 01:55:32,Here's a puppo that seems to be on the fence about something haha no but seriously someone help her. 13/10 https://t.co/BxvuXk0UCm,https://twitter.com/dog_rates/status/889665388333682689/photo/1,13,10,None,puppo,Pembroke,96.6327,True,Cardigan,2.73557,True,Basenji,0.46332300000000004,True,8538,38818
13,889638837579907072,2017-07-25 00:10:02,This is Ted. He does his best. Sometimes that's not enough. But it's ok. 12/10 would assist https://t.co/f8dEDcrKSR,"https://twitter.com/dog_rates/status/889638837579907072/photo/1,https://twitter.com/dog_rates/status/889638837579907072/photo/1",12,10,Ted,unavailable,French_Bulldog,99.165,True,Boxer,0.21286399999999997,True,Staffordshire_Bullterrier,0.149818,True,4735,27672
14,889531135344209921,2017-07-24 17:02:04,This is Stuart. He's sporting his favorite fanny pack. Secretly filled with bones only. 13/10 puppared puppo #BarkWeek https://t.co/y70o6h3isq,https://twitter.com/dog_rates/status/889531135344209921/photo/1,13,10,Stuart,puppo,Golden_Retriever,95.3442,True,Labrador_Retriever,1.38341,True,Redbone,0.7957749999999999,True,2321,15359
15,889278841981685760,2017-07-24 00:19:32,This is Oliver. You're witnessing one of his many brutal attacks. Seems to be playing with his victim. 13/10 fr*ckin frightening #BarkWeek https://t.co/WpHvrQedPb,https://twitter.com/dog_rates/status/889278841981685760/video/1,13,10,Oliver,unavailable,Whippet,62.6152,True,Borzoi,19.4742,True,Saluki,2.73507,True,5637,25652
16,888917238123831296,2017-07-23 00:22:39,This is Jim. He found a fren. Taught him how to sit like the good boys. 12/10 for both https://t.co/chxruIOUJN,https://twitter.com/dog_rates/status/888917238123831296/photo/1,12,10,Jim,unavailable,Golden_Retriever,71.4719,True,Tibetan_Mastiff,12.0184,True,Labrador_Retriever,10.550600000000001,True,4709,29611
17,888804989199671297,2017-07-22 16:56:37,This is Zeke. He has a new stick. Very proud of it. Would like you to throw it for him without taking it. 13/10 would do my best https://t.co/HTQ77yNQ5K,"https://twitter.com/dog_rates/status/888804989199671297/photo/1,https://twitter.com/dog_rates/status/888804989199671297/photo/1",13,10,Zeke,unavailable,Golden_Retriever,46.976,True,Labrador_Retriever,18.4172,True,English_Setter,7.34817,True,4559,26080
18,888554962724278272,2017-07-22 00:23:06,This is Ralphus. He's powering up. Attempting maximum borkdrive. 13/10 inspirational af https://t.co/YnYAFCTTiK,"https://twitter.com/dog_rates/status/888554962724278272/photo/1,https://twitter.com/dog_rates/status/888554962724278272/photo/1,https://twitter.com/dog_rates/status/888554962724278272/photo/1,https://twitter.com/dog_rates/status/888554962724278272/photo/1",13,10,Ralphus,unavailable,Siberian_Husky,70.0377,True,Eskimo_Dog,16.6511,True,Malamute,11.1411,True,3732,20290
19,888078434458587136,2017-07-20 16:49:33,This is Gerald. He was just told he didn't get the job he interviewed for. A h*ckin injustice. 12/10 didn't want the job anyway https://t.co/DK7iDPfuRX,"https://twitter.com/dog_rates/status/888078434458587136/photo/1,https://twitter.com/dog_rates/status/888078434458587136/photo/1",12,10,Gerald,unavailable,French_Bulldog,99.5026,True,Pug,0.09319079999999999,True,Bull_Mastiff,0.0903211,True,3653,22201
20,887705289381826560,2017-07-19 16:06:48,This is Jeffrey. He has a monopoly on the pool noodles. Currently running a 'boop for two' midweek sale. 13/10 h*ckin strategic https://t.co/PhrUk20Q64,https://twitter.com/dog_rates/status/887705289381826560/photo/1,13,10,Jeffrey,unavailable,Basset,82.1664,True,Redbone,8.75815,True,Weimaraner,2.6236400000000004,True,5609,30779
21,887517139158093824,2017-07-19 03:39:09,I've yet to rate a Venezuelan Hover Wiener. This is such an honor. 14/10 paw-inspiring af (IG: roxy.thedoxy) https://t.co/20VrLAA8ba,https://twitter.com/dog_rates/status/887517139158093824/video/1,14,10,such,unavailable,Limousine,13.043199999999999,False,Tow_Truck,2.9175400000000002,False,Shopping_Cart,2.6320799999999998,False,12082,46959
22,887473957103951883,2017-07-19 00:47:34,This is Canela. She attempted some fancy porch pics. They were unsuccessful. 13/10 someone help her https://t.co/cLyzpcUcMX,"https://twitter.com/dog_rates/status/887473957103951883/photo/1,https://twitter.com/dog_rates/status/887473957103951883/photo/1",13,10,Canela,unavailable,Pembroke,80.9197,True,Rhodesian_Ridgeback,5.495,True,Beagle,3.89148,True,18781,69871
23,887343217045368832,2017-07-18 16:08:03,You may not have known you needed to see this today. 13/10 please enjoy (IG: emmylouroo) https://t.co/WZqNqygEyV,https://twitter.com/dog_rates/status/887343217045368832/video/1,13,10,None,unavailable,Mexican_Hairless,33.0741,True,Sea_Lion,27.5645,False,Weimaraner,13.4203,True,10737,34222
24,887101392804085760,2017-07-18 00:07:08,This... is a Jubilant Antarctic House Bear. We only rate dogs. Please only send dogs. Thank you... 12/10 would suffocate in floof https://t.co/4Ad1jzJSdp,https://twitter.com/dog_rates/status/887101392804085760/photo/1,12,10,None,unavailable,Samoyed,73.3942,True,Eskimo_Dog,3.50295,True,Staffordshire_Bullterrier,2.9704700000000006,True,6167,31061
25,886983233522544640,2017-07-17 16:17:36,This is Maya. She's very shy. Rarely leaves her cup. 13/10 would find her an environment to thrive in https://t.co/I6oNy0CgiT,"https://twitter.com/dog_rates/status/886983233522544640/photo/1,https://twitter.com/dog_rates/status/886983233522544640/photo/1",13,10,Maya,unavailable,Chihuahua,79.3469,True,Toy_Terrier,14.352799999999998,True,Can_Opener,3.22529,False,8084,35859
26,886736880519319552,2017-07-16 23:58:41,"This is Mingus. He's a wonderful father to his smol pup. Confirmed 13/10, but he needs your help

https://t.co/bVi0Yr4Cff https://t.co/ISvKOSkd5b","https://www.gofundme.com/mingusneedsus,https://twitter.com/dog_rates/status/886736880519319552/photo/1,https://twitter.com/dog_rates/status/886736880519319552/photo/1",13,10,Mingus,unavailable,Kuvasz,30.970599999999997,True,Great_Pyrenees,18.613599999999998,True,Dandie_Dinmont,8.634630000000001,True,3443,12306
27,886680336477933568,2017-07-16 20:14:00,This is Derek. He's late for a dog meeting. 13/10 pet...al to the metal https://t.co/BCoWue0abA,https://twitter.com/dog_rates/status/886680336477933568/photo/1,13,10,Derek,unavailable,Convertible,73.89949999999999,False,Sports_Car,13.995199999999999,False,Car_Wheel,4.41727,False,4610,22798
28,886366144734445568,2017-07-15 23:25:31,This is Roscoe. Another pupper fallen victim to spontaneous tongue ejections. Get the BlepiPen immediate. 12/10 deep breaths Roscoe https://t.co/RGE08MIJox,"https://twitter.com/dog_rates/status/886366144734445568/photo/1,https://twitter.com/dog_rates/status/886366144734445568/photo/1",12,10,Roscoe,pupper,French_Bulldog,99.9201,True,Chihuahua,0.0361178,True,Boston_Bull,0.00755616,True,3316,21524
29,886267009285017600,2017-07-15 16:51:35,@NonWhiteHat @MayhewMayhem omg hello tanner you are a scary good boy 12/10 would pet with extreme caution,,12,10,None,unavailable,,,,,,,,,,4,117
30,886258384151887873,2017-07-15 16:17:19,This is Waffles. His doggles are pupside down. Unsure how to fix. 13/10 someone assist Waffles https://t.co/xZDA9Qsq1O,https://twitter.com/dog_rates/status/886258384151887873/photo/1,13,10,Waffles,unavailable,Pug,94.3575,True,Shower_Cap,2.5285599999999997,False,Siamese_Cat,0.284892,False,6523,28469
31,885984800019947520,2017-07-14 22:10:11,Viewer discretion advised. This is Jimbo. He will rip ur finger right h*ckin off. Other dog clearly an accessory. 12/10 pls pet with caution https://t.co/BuveP0uMF1,https://twitter.com/dog_rates/status/885984800019947520/photo/1,12,10,Jimbo,unavailable,Blenheim_Spaniel,97.2494,True,Shih-Tzu,0.6630119999999999,True,Bernese_Mountain_Dog,0.623915,True,7097,33382
32,885528943205470208,2017-07-13 15:58:47,This is Maisey. She fell asleep mid-excavation. Happens to the best of us. 13/10 would pat noggin approvingly https://t.co/tp1kQ8i9JF,https://twitter.com/dog_rates/status/885528943205470208/photo/1,13,10,Maisey,unavailable,Pug,36.9275,True,Labrador_Retriever,26.583499999999997,True,Kuvasz,13.469700000000001,True,6683,36689
33,885518971528720385,2017-07-13 15:19:09,I have a new hero and his name is Howard. 14/10 https://t.co/gzLHboL7Sk,https://twitter.com/4bonds2carbon/status/885517367337512960,14,10,None,unavailable,,,,,,,,,,3899,20788
34,885167619883638784,2017-07-12 16:03:00,Here we have a corgi undercover as a malamute. Pawbably doing important investigative work. Zero control over tongue happenings. 13/10 https://t.co/44ItaMubBf,"https://twitter.com/dog_rates/status/885167619883638784/photo/1,https://twitter.com/dog_rates/status/885167619883638784/photo/1,https://twitter.com/dog_rates/status/885167619883638784/photo/1,https://twitter.com/dog_rates/status/885167619883638784/photo/1",13,10,None,unavailable,Malamute,81.2482,True,Siberian_Husky,7.17125,True,Eskimo_Dog,5.57697,True,4556,22367
35,884925521741709313,2017-07-12 00:01:00,"This is Earl. He found a hat. Nervous about what you think of it. 12/10 it's delightful, Earl https://t.co/MYJvdlNRVa",https://twitter.com/dog_rates/status/884925521741709313/photo/1,12,10,Earl,unavailable,Italian_Greyhound,25.9916,True,American_Staffordshire_Terrier,19.8451,True,Staffordshire_Bullterrier,12.7725,True,16439,68152
36,884876753390489601,2017-07-11 20:47:12,This is Lola. It's her first time outside. Must test the earth and taste the atmosphere. 13/10 you're doing great Lola https://t.co/74TKAUsLkO,"https://twitter.com/dog_rates/status/884876753390489601/photo/1,https://twitter.com/dog_rates/status/884876753390489601/photo/1,https://twitter.com/dog_rates/status/884876753390489601/photo/1,https://twitter.com/dog_rates/status/884876753390489601/photo/1",13,10,Lola,unavailable,Chow,82.2103,True,Norwich_Terrier,10.6075,True,Norfolk_Terrier,3.73485,True,6096,28514
37,884562892145688576,2017-07-11 00:00:02,This is Kevin. He's just so happy. 13/10 what is your secret Kevin https://t.co/1r4MFCbCX5,https://twitter.com/dog_rates/status/884562892145688576/photo/1,13,10,Kevin,unavailable,Pug,54.640600000000006,True,French_Bulldog,40.4291,True,Brabancon_Griffon,4.400189999999999,True,5100,24765
38,884441805382717440,2017-07-10 15:58:53,"I present to you, Pup in Hat. Pup in Hat is great for all occasions. Extremely versatile. Compact as h*ck. 14/10 (IG: itselizabethgales) https://t.co/vvBOcC2VdC",https://twitter.com/dog_rates/status/884441805382717440/photo/1,14,10,None,unavailable,Pembroke,99.3225,True,Cardigan,0.321648,True,Chihuahua,0.20808900000000002,True,5856,27478
39,884247878851493888,2017-07-10 03:08:17,OMG HE DIDN'T MEAN TO HE WAS JUST TRYING A LITTLE BARKOUR HE'S SUPER SORRY 13/10 WOULD FORGIVE IMMEDIATE https://t.co/uF3pQ8Wubj,https://twitter.com/kaijohnson_19/status/883965650754039809,13,10,None,unavailable,,,,,,,,,,21298,74423
40,884162670584377345,2017-07-09 21:29:42,Meet Yogi. He doesn't have any important dog meetings today he just enjoys looking his best at all times. 12/10 for dangerously dapper doggo https://t.co/YSI00BzTBZ,https://twitter.com/dog_rates/status/884162670584377345/photo/1,12,10,Yogi,doggo,German_Shepherd,70.7046,True,Malinois,19.9396,True,Norwegian_Elkhound,4.91476,True,3128,20771
41,883838122936631299,2017-07-09 00:00:04,This is Noah. He can't believe someone made this mess. Got the vacuum out for you though. Offered to help clean pup. 12/10 super good boy https://t.co/V85xujjDDY,https://twitter.com/dog_rates/status/883838122936631299/photo/1,12,10,Noah,unavailable,Doberman,61.0946,True,Miniature_Pinscher,29.9603,True,Kelpie,6.30203,True,3586,22349
42,883482846933004288,2017-07-08 00:28:19,"This is Bella. She hopes her smile made you smile. If not, she is also offering you her favorite monkey. 13.5/10 https://t.co/qjrljjt948","https://twitter.com/dog_rates/status/883482846933004288/photo/1,https://twitter.com/dog_rates/status/883482846933004288/photo/1",5,10,Bella,unavailable,Golden_Retriever,94.3082,True,Labrador_Retriever,3.2409,True,Kuvasz,0.550072,True,10407,46860
43,883360690899218434,2017-07-07 16:22:55,Meet Grizzwald. He may be the floofiest floofer I ever did see. Lost eyes saving a schoolbus from a volcano erpuption. 13/10 heroic as h*ck https://t.co/rf661IFEYP,https://twitter.com/dog_rates/status/883360690899218434/photo/1,13,10,Grizzwald,floofer,Chow,98.7997,True,Tibetan_Mastiff,0.7098720000000001,True,Newfoundland,0.21403300000000003,True,3825,22986
44,883117836046086144,2017-07-07 00:17:54,"Please only send dogs. We don't rate mechanics, no matter how h*ckin good. Thank you... 13/10 would sneak a pat https://t.co/Se5fZ9wp5E","https://twitter.com/dog_rates/status/883117836046086144/photo/1,https://twitter.com/dog_rates/status/883117836046086144/photo/1",13,10,None,unavailable,Golden_Retriever,94.9562,True,Labrador_Retriever,4.5947900000000015,True,Kuvasz,0.247094,True,6949,37914
45,882992080364220416,2017-07-06 15:58:11,This is Rusty. He wasn't ready for the first pic. Clearly puppared for the second. 13/10 confirmed great boy https://t.co/tyER0KpdXj,"https://twitter.com/dog_rates/status/882992080364220416/photo/1,https://twitter.com/dog_rates/status/882992080364220416/photo/1",13,10,Rusty,unavailable,Eskimo_Dog,46.677800000000005,True,Siberian_Husky,40.6044,True,Dingo,7.341439999999999,False,4122,24445
46,882762694511734784,2017-07-06 00:46:41,This is Gus. He's quite the cheeky pupper. Already perfected the disinterested wink. 12/10 would let steal my girl https://t.co/D43I96SlVu,https://twitter.com/dog_rates/status/882762694511734784/photo/1,12,10,Gus,pupper,Labrador_Retriever,85.005,True,Chesapeake_Bay_Retriever,7.4257,True,Flat-Coated_Retriever,1.5579399999999997,True,5134,28903
47,882627270321602560,2017-07-05 15:48:34,This is Stanley. He has his first swim lesson today. Doggle straps adjusted. Ready to go. 13/10 Phelps is nervous (IG: stanleythe_corgi) https://t.co/Nx52PGwH94,https://twitter.com/dog_rates/status/882627270321602560/photo/1,13,10,Stanley,unavailable,Pembroke,54.298199999999994,True,Chihuahua,25.1988,True,Cardigan,10.7699,True,6342,28382
48,882268110199369728,2017-07-04 16:01:23,This is Alfy. You're witnessing his first watermelon experience. I think it was a success. 13/10 happy 4th Alfy ðŸ‡ºðŸ‡¸ https://t.co/fYP5RlutfA,"https://twitter.com/dog_rates/status/882268110199369728/photo/1,https://twitter.com/dog_rates/status/882268110199369728/photo/1,https://twitter.com/dog_rates/status/882268110199369728/photo/1",13,10,Alfy,unavailable,Golden_Retriever,76.22109999999999,True,Labrador_Retriever,9.89849,True,Cocker_Spaniel,1.7199499999999999,True,12118,45880
49,882045870035918850,2017-07-04 01:18:17,"This is Koko. Her owner, inspired by Barney, recently built a cart for her to use during walks if she got tired. 13/10 rest easy Koko https://t.co/zeDpnsKX7w","https://twitter.com/dog_rates/status/882045870035918850/photo/1,https://twitter.com/dog_rates/status/882045870035918850/photo/1,https://twitter.com/dog_rates/status/882045870035918850/photo/1,https://twitter.com/dog_rates/status/882045870035918850/photo/1",13,10,Koko,unavailable,Web_Site,94.95909999999999,False,Dhole,1.7325799999999998,False,Golden_Retriever,0.694063,True,5203,29900
50,881906580714921986,2017-07-03 16:04:48,This is Rey. He's a Benebop Cumberfloof. 12/10 dangerously pettable https://t.co/503CgWbhxQ,https://twitter.com/dog_rates/status/881906580714921986/photo/1,12,10,Rey,unavailable,Weimaraner,29.1539,True,Chesapeake_Bay_Retriever,27.8966,True,Koala,12.701700000000002,False,3533,24773
51,881666595344535552,2017-07-03 00:11:11,This is Gary. He couldn't miss this puppertunity for a selfie. Flawless focusing skills. 13/10 would boop intensely https://t.co/7CSWCl8I6s,https://twitter.com/dog_rates/status/881666595344535552/photo/1,13,10,Gary,unavailable,Saluki,52.9012,True,Afghan_Hound,25.000300000000003,True,Golden_Retriever,16.073900000000002,True,11099,51522
52,881633300179243008,2017-07-02 21:58:53,@roushfenway These are good dogs but 17/10 is an emotional impulse rating. More like 13/10s,,17,10,None,unavailable,,,,,,,,,,7,129
53,881536004380872706,2017-07-02 15:32:16,"Here is a pupper approaching maximum borkdrive. Zooming at never before seen speeds. 14/10 paw-inspiring af 
(IG: puffie_the_chow) https://t.co/ghXBIIeQZF",https://twitter.com/dog_rates/status/881536004380872706/video/1,14,10,a,pupper,Samoyed,28.146300000000004,True,Angora,27.206599999999998,False,Persian_Cat,11.4854,False,16570,50199
54,881268444196462592,2017-07-01 21:49:04,Meet Elliot. He's a Canadian Forrest Pup. Unusual number of antlers for a dog. Sneaky tongue slip to celebrate #Canada150. 12/10 would pet https://t.co/cgwJwowTMC,https://twitter.com/dog_rates/status/881268444196462592/photo/1,12,10,Elliot,unavailable,Tusker,47.330299999999994,False,Indian_Elephant,24.5646,False,Ibex,5.56607,False,5358,23501
55,880935762899988482,2017-06-30 23:47:07,This is Louis. He's crossing. It's a big deal. 13/10 h*ckin breathtaking https://t.co/D0wb1GlKAt,https://twitter.com/dog_rates/status/880935762899988482/photo/1,13,10,Louis,unavailable,Street_Sign,25.1801,False,Umbrella,11.5123,False,Traffic_Light,6.953380000000001,False,2886,17346
56,880872448815771648,2017-06-30 19:35:32,Ugh not again. We only rate dogs. Please don't send in well-dressed  floppy-tongued street penguins. Dogs only please. Thank you... 12/10 https://t.co/WiAMbTkDPf,https://twitter.com/dog_rates/status/880872448815771648/photo/1,12,10,None,unavailable,Pembroke,79.1416,True,Norwich_Terrier,6.13929,True,Chihuahua,3.3725699999999996,True,3989,21734
57,880465832366813184,2017-06-29 16:39:47,This is Bella. She had her first beach experience this morning. Complete success. 12/10 would perform a sandy boop https://t.co/4VsFysDmiw,"https://twitter.com/dog_rates/status/880465832366813184/photo/1,https://twitter.com/dog_rates/status/880465832366813184/photo/1,https://twitter.com/dog_rates/status/880465832366813184/photo/1,https://twitter.com/dog_rates/status/880465832366813184/photo/1",12,10,Bella,unavailable,Golden_Retriever,91.3255,True,Labrador_Retriever,2.63286,True,Cocker_Spaniel,0.937082,True,6546,29075
58,880221127280381952,2017-06-29 00:27:25,Meet Jesse. He's a Fetty Woof. His tongue ejects without warning. A true bleptomaniac. 12/10 would snug well https://t.co/fUod0tVmvK,"https://twitter.com/dog_rates/status/880221127280381952/photo/1,https://twitter.com/dog_rates/status/880221127280381952/photo/1",12,10,Jesse,unavailable,Chihuahua,23.8525,True,Meerkat,10.4256,False,Clumber,5.258030000000001,True,4436,27640
59,880095782870896641,2017-06-28 16:09:20,Please don't send in photos without dogs in them. We're not @porch_rates. Insubordinate and churlish. Pretty good porch tho 11/10 https://t.co/HauE8M3Bu4,https://twitter.com/dog_rates/status/880095782870896641/photo/1,11,10,None,unavailable,Miniature_Pinscher,12.0298,True,Rhodesian_Ridgeback,10.6395,True,Beagle,10.6073,True,4533,28150
60,879862464715927552,2017-06-28 00:42:13,This is Romeo. He would like to do an entrance. Requesting your immediate assistance. 13/10 https://t.co/Qh5aEkRQm9,"https://twitter.com/dog_rates/status/879862464715927552/photo/1,https://twitter.com/dog_rates/status/879862464715927552/photo/1,https://twitter.com/dog_rates/status/879862464715927552/photo/1",13,10,Romeo,unavailable,Basset,81.3507,True,Beagle,14.6654,True,Cocker_Spaniel,0.9485020000000001,True,3642,22667
61,879674319642796034,2017-06-27 12:14:36,@RealKentMurphy 14/10 confirmed,,14,10,None,unavailable,,,,,,,,,,10,315
62,879492040517615616,2017-06-27 00:10:17,This is Bailey. He thinks you should measure ear length for signs of growth instead. 12/10 https://t.co/IxM9IMKQq8,https://twitter.com/dog_rates/status/879492040517615616/photo/1,12,10,Bailey,unavailable,German_Short-Haired_Pointer,47.989599999999996,True,Vizsla,12.4353,True,Bath_Towel,7.33202,False,3323,23822
63,879415818425184262,2017-06-26 19:07:24,This is Duddles. He did an attempt. 13/10 someone help him (vid by Georgia Felici) https://t.co/UDT7ZkcTgY,https://twitter.com/dog_rates/status/879415818425184262/video/1,13,10,Duddles,unavailable,English_Springer,38.3404,True,Boston_Bull,13.4967,True,Cardigan,11.0481,True,45849,107956
64,879376492567855104,2017-06-26 16:31:08,This is Jack AKA Stephen Furry. You're not scoring on him. Unless he slips down the slide. 12/10 would happily get blocked by https://t.co/0gOi601EAa,https://twitter.com/dog_rates/status/879376492567855104/photo/1,12,10,Jack,unavailable,Tricycle,66.3601,False,Labrador_Retriever,3.34961,True,Pembroke,1.88266,True,3261,17099
65,879050749262655488,2017-06-25 18:56:45,This is Steven. He has trouble relating to other dogs. Quite shy. Neck longer than average. Tropical probably. 11/10 would still pet https://t.co/2mJCDEJWdD,https://twitter.com/dog_rates/status/879050749262655488/photo/1,11,10,Steven,unavailable,Tabby,31.1861,False,Window_Screen,16.9123,False,Egyptian_Cat,13.293199999999999,False,4941,23022
